start	end	text
4853134	4854615	y me empecé a hacer al vivo con unos narcos
4855396	4858619	y me dice que un seguridad me sacó porque ya me iban a boletear
4859479	4862842	porque le estaba tomando el pelo de las botas, usan botas puntiagudas
4862862	4866165	y yo le decía que si eran de cuero de pija que me den un padre de patas en el culo
4867087	4871130	dice que yo le dije eso a los narcos y que loco cuando yo dije eso me agarró y
4871150	4875793	me hizo como que me echó del boliche porque el el security estaba con los que
4875813	4879196	me llevan del evento y que me sacó porque dicen los narcos ya estaban viste
4879216	4879696	a punto de
4880558	4882159	Ya fuiste a descansar uno de los narcos.
4882219	4884900	Sí, sí, sí. Estaba re puesto, mal, este.
4885180	4887021	Y tuve esa suerte, viste.
4888382	4890723	Tenés que hacer ese libro, tenés que hacer...
4890943	4893024	Pero admite que tiene una etapa solemne.
4893084	4893805	Como nada hay que ver.
4893865	4895445	O sea, tenés que estar vos en blanco y negro,
4895465	4895986	como escribón así.
4896006	4898127	Quería preguntarle, cibi-xibi.
4898707	4899307	Este...
4899387	4902049	Cuentos bizarros de la gira bananera, viste.
4902069	4903089	Siempre me gustó cibi-xibi,
4903109	4905370	pero igual creo que tendría que pagar derechos o algo.
4906131	4906671	No, maldado.
4906691	4908572	Pero no, no, me gustaría que sea algo totalmente...
4911134	4914436	Un contraste, que vean qué tipo soy, un tipo de mundo,
4914496	4917478	un tipo que endua por todos lados y está que...
4917498	4917938	Sí, boludo.
4917978	4920620	Que me cagué encima en el pasillo de un hotel y cosas de esas.
4920700	4921540	Está bueno. También.
4921580	4924902	Bueno, es que de todos esos años tiene que haber historias a Rolandio.
4924922	4925883	Vos estabas, mi amor, ahí.
4926203	4927464	Cuando se cagó encima...
4927484	4930105	Sí, ¿te acordás que la limpiadora no me abría la...
4930126	4931266	Sí, ¿cómo?
4932508	4935472	Esa fue la primera vez que la conocí, así que fue la prueba de fuego, digo.
4935552	4937374	Después de eso yo dije, ella me ama de verdad.
4937414	4939616	¿O conociste a tu pareja cagado en el pasillo de un hotel?
4940297	4943040	Bueno, más o menos, ya nos habíamos estado una noche juntos.
4943962	4945603	Bien, pero ahí te conoció más a fondo.
4945623	4951365	Sí, no, creo que, digo, si con eso es como el coso
4952025	4953686	de la película esta de América.
4954306	4957387	Si te abre la puerta cuando está trancado al lado adentro,
4957487	4960288	es de una película, creo que es
4960348	4962048	Once Upon a Time in America o algo así.
4962769	4964129	No... ¿Cuál?
4964489	4965490	O es de Good Fellas.
4967473	4971598	que como una prueba de fuego, de confianza, que vas a buscar a una chica y vos le abrís
4971638	4976604	la puerta y vos vas por atrás y si tu puerta está cerrada ella te la abre.
4977307	4985210	Bueno, mi versión de eso es que si te ve cagando está todo bien y te da el dedo arriba y no se asquea y te trae el papel.
4985450	4988871	Hermoso, una verdadera historia de amor a la altura de la contemporaneidad.
4988891	4992732	Te hago una consulta y también pregunto, ¿cómo estamos de tiempo?
4993412	4993672	Hora 23.
4993732	4994812	¿Hora 23, vamos? ¿Vos cómo está, amigo?
4995332	4995993	Yo puedo seguir.
4996173	4996773	Vos puedes seguir.
4996793	4997313	Todo lo que quieran.
4997553	4998213	Quiero hablar de...
5000695	5005677	Una cosa segura, a nivel tópico, porque ya lo tocamos igual con los intereses, con lo que te gusta,
5006198	5010980	pero una persona que disfruta de hacer lo que vos haces y que lo hace con ese nivel de minuciosidad y
5011000	5017583	calidad, tiene mucho visión estética, visión de curaduría de arte. O sea, yo me imagino que a
5017603	5022806	usted tiene que gustar mucho el cine. Sí, sí, me encanta, me encanta. Digo, miro muchísimas películas,
5022826	5023646	tengo mis favoritos.
5025188	5032373	Scorsese, Tarantino, Christopher Nolan, Paul Michael Anderson, me encanta, trato de ver.
5032653	5040339	Me gusta Wes Anderson, me gusta cuando, esta me quiere mucho, muchas gracias, gus gus.
5040679	5045122	Me gusta cuando vos podés decir, esta película es de tal director, como un baterista, como vos decís, este es...
5045363	5046204	Cuando reconoces el sello.
5046224	5049164	Poncho Bonham, guitarrista, es Jeff Beck.
5049284	5055926	Digo, siempre me gusta comparar todo con la música, con el cine y con lo que yo hago.
5055946	5056686	Creo que tiene mucho que ver.
5056746	5057566	Y el porno también.
5059086	5064167	En el sentido de, no la calidad, sino que sea lo bizarro de ese lado.
5064407	5067828	Claro. O sea, reconocer el sello de la mano de un artista en algo.
5067848	5069208	Sí, sí, sí. Eso es fascinante.
5069328	5072529	Y digo, creo que yo, alguien puede decir este vídeo.
5072569	5074329	Bueno, porque aparezco, no, obvio, pero...
5074830	5075910	Este es un bananero original.
5075970	5076530	Claro, exacto.
5076610	5080932	Esto se puede estar en el loop de los videos bizarros.
5080972	5085873	Porque sí, es ese más, es 40 por 320 de la época buena, viste?
5085933	5088294	Y te guste, claro, claro, reconoces el.
5088314	5090015	Los que mirabas, este, en baja, no?
5090035	5091215	Sí, tal cual.
5091415	5092075	En rojo.
5092296	5094216	Le, eh, te gusta.
5094276	5095197	¿Puedo fumar un pucho acá?
5095217	5096537	Sí, lo que vos quieras, lo que vos quieras.
5096557	5098157	Amor, tenemos, pasemos un cenicerito.
5098198	5098418	¿Qué pasó?
5098458	5099178	El micrófono.
5099938	5100698	¿Qué, quedó alto?
5102661	5105983	¿Estamos bien? Dale, sí, muchísimas gracias.
5108445	5111528	Hoy tengo que ensayar con áspera, voy a quedar, voy a llegar como loquita.
5111908	5113329	Voy a seguir, voy a probar la negra.
5116953	5120195	Hacemos también.
5120275	5121196	Está el ensayo.
5121697	5123838	Sí, no, no, no. Me está enfocando.
5124380	5128123	En alguna tiene que entrar, boludo.
5129804	5130364	Eh, ¿sabes qué?
5130384	5132846	Sí, este, coman sanguchitos, yo no, no, no creo que le va a gustar.
5132866	5133766	¿Alguien quiere de acá? ¿De última?
5133806	5134447	Ahí estamos agarrando...
5136048	5137869	Ah, listo. Ahí te pasa ahora entonces el fuego.
5138810	5140250	Eh... ¿Cómo?
5140591	5141591	Ah, voy a catar la...
5142692	5144613	Happy... Happy negra.
5145414	5145734	Con venas.
5145754	5147695	Voy a dar privacidad para que te chupes la happy negra.
5147835	5148596	Dale, me parece bien.
5152238	5153459	Esa me dijeron que es la... Bueno.
5153719	5154640	Es muy rica la happy, ¿eh?
5155582	5157524	Eso también lo quiero aclarar para gente que está viendo este vídeo.
5157544	5159666	No es solo una cara bonita en la tapa.
5159726	5161768	No, no es buena. Es buena calidad.
5163390	5165132	Traté de buscar las mejores cervezas.
5165432	5168496	Fue un poco difícil al principio porque se nos cerraron muchas puertas
5168516	5171279	por el nombre y todo. Yo decía Happy, es feliz en inglés.
5172962	5176444	No, no quería entender a la gente. Pensaron que era algo misógeno y todo, nada que ver.
5176945	5180247	Pero bueno, el humor es un idioma que no entienden todos.
5180267	5181068	No entendieron tu arte.
5181488	5182609	Sí, no entendieron el craft.
5183449	5188373	Y vos, eso también te interesa a nivel producto, ¿no? La cataduría de eso, que esté buena.
5188393	5195377	Sí, tampoco quiero que tenga ese gusto frutal y todo. No, no llego a ese nivel de esnovismo, de saber tanto.
5195397	5197399	A mí me gusta una cerveza que te puedas tomar varias.
5198081	5203547	que te emborrache y no que se trate de ah mira todo lo que sé de cerveza y puedo comentar de esto
5203587	5212296	lo otro no soy este un yacero la cerveza soy rockero viste tipo simple que sea tomable y que te emborrache
5212539	5216981	En esto del yacero y la calidad del arte, va relacionado con lo del cine que te quería preguntar,
5217061	5223083	porque así como me nombras, buenos autores, o sea, gente aclamada por su calidad,
5223123	5225764	por su profesionalismo, por su nivel, ¿no? Categoría.
5226505	5230026	Vos también sos un tipo que disfruta a cagar de Marvel, o sea...
5230086	5231147	Sí, sí, sí, por supuesto.
5232729	5235071	La gente que lo considera una garcha...
5235151	5236653	No, no, no, me encanta este...
5237413	5240396	Volver al futuro, me encanta este...
5240456	5243700	Películas así que son masivas, pero que son buenas, ¿entendés?
5244180	5247724	Este... La de Rápido y Furioso me parece una poronga, este...
5247844	5248064	Digo...
5248547	5249647	Reto Tokio no está mal, ¿eh?
5249787	5250087	¿Cómo?
5250167	5251047	Reto Tokio no está mal.
5251087	5254028	No, no, no, tengo disculpas si te gusta, pero no.
5254488	5259690	Esas, las Transformers, me parece que es un sobregasto de plata,
5259730	5262651	pero hay otras que son masivas, las de Marvel me parecen espectaculares.
5262711	5265291	Vos sos en discusión Marvel o DC.
5266492	5276216	Y creo que Marvel, después de que ellos mismos se dieron cuenta de armar el universo cinematográfico
5276236	5284059	de Marvel, de película-presentación, presentación de otro, y después unirlos y hacer toda esa...
5283619	5290343	esa pirámide es un concepto avanzadísimo y por eso rompieron todo, es espectacular.
5290383	5290983	Ahí los liquidaron.
5291003	5294465	Creo que ahora le están cagando con esos twists que están haciendo en series, ahora
5295025	5297146	Disney compró eso y creo que ya está.
5297186	5303370	Sabía que te iba a preguntar porque yo pienso lo mismo, para mí Marvel hace una enorme
5303390	5308973	diferencia cuando deja de querer como competir en esta localidad o oscuridad y viene el Feige
5309073	5312775	y este hace un plan quinquenal de películas, agarramos esa película por 20 años.
5313236	5318443	sí sí sí sí y los otros se fueron volviendo locos a mí no no no no sabían por dónde agarrar
5318503	5328175	es como garchar una ok este no me salía la palabra de más yo siento que una epiléptica es complicado
5329618	5335060	Creo que el peor de los escenarios posibles para completar la frase con 30 segundos de delay.
5335080	5337961	Por lo general siempre es la peor opción.
5338021	5340921	Bueno, si tomó su tiempo va a no banquinear.
5340941	5343182	No, no, no. Si lo voy a decir, lo voy a decir.
5344023	5347624	Y DC parece que solo tiene...
5347744	5350405	DC solo tiene Batman, boludo. Es como que...
5350505	5353226	Sí, saca una buenísima...
5353826	5356647	Y después una poronga, Wonder Woman.
5356687	5359068	Fue buenísima, entre todo, como la presentaron y todo.
5359088	5360089	Después saca Wonder Woman 84.
5360129	5363650	La tipa al lado mío en el aeropuerto,
5363910	5366291	en el avión la estaba mirando, casi me tiró.
5366351	5368331	La veía, qué película de mierda.
5368391	5371052	Y la estoy mirando en modo mudo.
5371473	5372933	Claro. Es malísima, ¿entendés?
5374794	5379296	La Liga de la Justicia también, otra mal, después la dirige Zack Snyder, agarra el...
5379396	5383297	¿Cómo fue eso? ¿Agarró el mismo material y la rehizo y la hizo bien? No sé.
5383417	5388879	Vos viste, fue así, Snyder agarra la Liga de la Justicia y el Chabón claramente, para mí,
5388939	5391660	tenía una idea medio de señor de los anillear.
5392180	5394341	Claro. Quería hacer una saga...
5394401	5397522	Una cosa épica, viste, de escala, con superhéroes, pero señor de los anillos.
5397542	5401083	No, pero vos la queremos para fin de año, tenemos que competir contra Bencher,
5401103	5402083	que nos está rompiendo el culo.
5402123	5403083	Después al Chabón tiene una...
5403284	5405886	una cosa familia muy jodida, creo que muere una hija,
5405926	5409209	o sea, una cosa heavy, lo sacan y meten a un director,
5409289	5411131	meten al que hizo, si no me equivoco...
5411251	5413213	No, a Avengers 1, meten a...
5414654	5416255	Ay, se me foran el nombre de este hijo de puta.
5416275	5418798	Pero meten al de Avengers 1 a dirigirle la película a él
5418958	5421080	y se la rompe toda, o sea, agarra y la marveriza.
5421100	5422881	Si te dije vos, evite la que dices.
5423021	5424182	¿Y sabes a nadie? Se vuelve loco.
5424342	5425463	Se vuelve loco...
5426424	5427645	George Widon. Ahí está, gracias.
5428467	5438211	Zack Snyder se vuelve loco y empieza la campaña esta del SnyderCat y el SnyderCat yo no digo que la salva el SnyderCat, pero por lo menos vos ves una idea de película, tenia una idea Zack SnyderCat.
5438231	5444733	Hacer una película, hacer como decís vos un universo, una trilogía es otra cosa, tenés que saber que es a largo plazo.
5453417	5458699	¿Y de Marvel, por ejemplo? ¿Tenés un top? ¿Un top 5 de Marvel? Si vos tenés que decir...
5458759	5466261	Creo que las Avengers Infinity War me parece espectacular. Endgame me parece un buen drama.
5466301	5474524	Digo, es hasta triste. Están todos con el culo roto, ¿entendés? Parece el aftermath de una película post-apocalíptica.
5475706	5479988	Pero creo que Infinity War es la mejor de todas, yo hago tops de esos y creo que la puse número uno.
5480529	5487273	Pero para mí, sin duda, es la mejor película de superhéroe, para mí es The Dark Knight, de Christopher Nolan.
5487293	5492816	Digo, para mí, porque no hay nadie volando ni nada, el loco usa la menor cantidad de CGI posible.
5493357	5495498	Tiene actores fantásticos, está Peloconcha,
5495598	5497919	digo que es un actorazo, este...
5497939	5500540	Y hizo magia, boludo.
5500600	5502641	Esa trilogía es espectacular.
5502701	5504602	Es... Christopher Nolan Balman es...
5504622	5506203	Estamos hablando de una película, en serio, ¿no?
5506363	5509044	Es una película que puede entrar en la categoría de superhéroe
5509084	5512525	o en la película de drama al lado de Taxi Driver,
5512545	5513946	como The Joker también, ¿entendés?
5513966	5517828	Creo que los de DC se prestan o tuvieron una tendencia
5517848	5520469	que se pueden prestar mucho más a hacer películas...
5521210	5523931	reales y no tanto de fantasía. Bueno, es que cuando D.C.,
5524511	5528433	para mí, acepta lo que es… Parece que estamos en el perro verde.
5528453	5528793	Sí, sí, sí.
5529354	5531154	Cuando D.C.… Un humo.
5531254	5533836	Un humo generalizado. Cuando D.C. acepta lo que es
5534116	5537798	y no trata de posar de Marvel, o sea, cuando no quiere correr, sale bien, boludo.
5538098	5541719	Tal cual. Cuando quieres ser lo que no sos, la cagas.
5541739	5544041	Eso es ser trolazo para mí. Eso es ser trolazo.
5544061	5545981	No tiene que ver con la sexualidad ni nada.
5546001	5549043	Cuando querés sobreposar, querés ser algo que no sos,
5551045	5557697	No sé, sacar a alguien del lugar que tiene y ponerte voz, me parece trolazo.
5557797	5558278	Ahí pifías.
5558759	5560622	Sí, claro, estás temeando afuera de él.
5560946	5563347	Y es que son... Pero son buenísimas, boludo.
5563367	5566109	Yo no sé si me gusta más Batman Inicia que Dark Knight,
5566149	5567350	pero estoy siempre ahí entre las dos.
5567390	5569931	Sí, bueno, también está... No es espectacular.
5569951	5573173	Pero la uno que construyeron, donde rearman la mitología loco...
5573193	5575574	Lo único que no me gusta es el bigote de mentira de...
5575594	5577616	-"El día de Amnesión". -"De Razalhul".
5577636	5580537	Todas las películas... Y el bigote ese se le mueve con el vientit,
5580557	5583239	hijo de puta, es que hicieron unas muy buenas tomas con él.
5583519	5584680	Sí, sí, tal cual, tal cual.
5584700	5588102	No, pero el bigote que le sacan a Superman...
5588723	5590064	No, eso es una locura.
5590444	5591444	Eso es una locura.
5591464	5593545	¡Afeitate el bigote! Eso es una locura.
5593846	5596167	Pero eso ya es la liga de la justicia
5596187	5597807	donde ya estaba todo pifiado.
5597827	5600589	Caía Ben Affleck escabio al set, no se le podía hablar.
5600629	5602610	O sea, esa película ya está todo mal.
5602630	5605531	Todo arruinado. Está todo mal y está emparchada en edición
5605551	5609093	para que más o menos camine, pero estaban rotos ya.
5609353	5610474	No había absolutamente nada.
5610655	5613555	Sí, es bravo, pero me doy cuenta lo que vos estás diciendo
5613575	5617696	de que están tratando de ellos hacer su versión de Avengers DC.
5618216	5620037	Con que llamen al director de Avengers.
5620297	5621537	Te traigaste fuera o no?
5621957	5625258	Papá, pensá fuera de la caja, como dicen, think outside the box.
5625398	5628339	Y están y aparte estás condenado a correr la pelota de atrás,
5628719	5630959	básicamente, o sea, va a estar siempre en el juego del otro.
5632740	5635500	Qué más de y esto te quería preguntar.
5636582	5640966	Igual ya lo dijiste, pero Marvel, fase 4, ¿qué pensás de las de ahora, de esta etapa?
5641707	5647934	Y el tema, viste, que se desdibuja un poco porque los que forjaron los personajes,
5648014	5651137	Robert Downey Jr., John Smas, Iron Man.
5652841	5673139	El que hace de Capitán América, lo único bueno que hace son los memes, esos que dice, ¿viste?, los chistes en el ascensor, ya no es más él, ahora es él, él, él, el moreno, este, después ¿qué tenés?, la última de Thor dicen que fue un pedazo de basura y yo lo revanco a Chris Hemsworth, digo, me dejaría regarchar, perdón, amor,
5673841	5676203	Es muy fachero Chris Hempworth mal.
5676223	5680327	Y me cae bien, me parece que es un loco que podés tomarte 80 birras y...
5680347	5684791	Yo la vi, Love and Thunder, y mira que yo los banco, lo mismo que si vos.
5684891	5687193	Mira que quiero que me guste, cuando vos me salgo diciendo...
5687393	5687894	Quiero bancar.
5688054	5689876	Está sugestionado que te guste porque...
5689896	5691257	Y me parece una poronga.
5693841	5696722	La única cosa que me la salvó un poquito fue una persona que me dijo
5697003	5698924	¿Sabes qué pasa? De verdad es para chicos.
5698964	5702785	Como que me dijeron mis nenes de ocho años es su película favorita.
5702805	5706027	Entonces, quizás ahí te puede empezar a pasar algo a nivel segmentación
5706347	5707988	que no la hicieron para mí.
5708148	5712270	Sí, pero eso te está demostrando que la diferencia en.
5713432	5719915	en toma de decisiones y direccionamiento de marketing después que compró Disney,
5719955	5724877	¿no? Porque Disney compró todo. Sí, a mí me pasa con Disney, yo configuro en Disney,
5724897	5729100	a mí Disney me dio las mejores películas de Disney, son número uno, pero... Pero cómo que
5729200	5736943	está, digo, me parece bien todo el tema que quiera que sea variado, que sea multigénero, todo, siempre
5736963	5737904	explicando este...
5738685	5743110	pareja natural. Digo, eso lo veo de mi lado, viste, yo soy un precursor de eso,
5743270	5747235	poner al hombre de araña, tipo el 2007, digo, nadie lo estaba haciendo, así que...
5747517	5750780	Ahora sí, sí, sí. Es buena esa reversión de la línea de si yo estaba incluyendo...
5750800	5755204	Yo digo desde antes, digo, digo, no me juzguen por lo que voy a decir, de la atrocidad que voy a decir,
5755244	5761949	pero a veces parece un poco esforzado cuando tratan de meter muchas cosas en sólo una película
5761969	5763631	para quedar bien con todo el mundo.
5763771	5766713	Sí, cuando claramente es algo que me parece que no hace...
5766733	5769536	Es un recurso de marketing, te das cuenta que no es un recurso de...
5770698	5775440	de escritura ni de guión. Me parece, no sé, puede estar muy equivocado como muchas veces.
5775460	5779441	No, igual coincido, porque hay veces que eso se hace y va de la mano con un tratamiento
5779461	5783822	natural del tema, cuando es verdaderamente inclusivo y está bueno, ¿viste? Y lo forzado
5783842	5784843	se nota forzado.
5784903	5792225	Sí, sí, forzado, sí. Y creo que eso te das cuenta, digo, al momento, digo, con las
5792265	5795766	entradas y todo, ¿viste? Digo, capaz que funcione el boom, que todo el mundo la ve,
5795786	5796006	pero...
5796948	5799289	No funcionó, no hubo química, no hubo...
5799769	5800990	Hay películas que sí, películas que no.
5801250	5802550	No trasciende después, aparte.
5803111	5804451	¿Nunca te...
5804532	5807273	En estas posibles mutaciones que uno tiene y pensando para adelante, incluso,
5807293	5808994	¿nunca te dieron ganas de hacer una película?
5809754	5812356	Estoy en eso, mi idea es hacer una película
5812376	5816978	para cuando se cumplan los 20 años del primer video Bananero,
5816998	5818199	que es en agosto del 2024.
5818239	5818379	Mirá.
5818399	5821020	Ahí se cumplen 20 años y mi idea sería hacer...
5825544	5827686	Esto no lo sabe nadie, es primicia acá en Tomás Ribor.
5827907	5828828	Primicia total.
5828848	5834534	Vamos a tratar de ver si podemos juntar fondos
5835715	5838879	y ponerla para verla gratis, porque voy a usar películas,
5838899	5842783	voy a usar música que, digo, no la podría poner en YouTube
5842803	5845126	y en ningún lado, porque me rompería el culo con copyright.
5845748	5847850	Entonces, si quiero usar Smoke and the Water,
5847870	5851512	si quiero usar Welcome to the Jungle, lo voy a usar.
5851532	5854474	Si quiero usar escenas de películas de Paramount,
5854494	5855395	de todo lo voy a usar.
5855775	5856416	Y meterme...
5857316	5859057	Se llamaría el multivergazo Bananerios,
5859077	5863280	donde yo, viste, voy y uno todo y explico todo cómo pasa.
5863380	5864661	Espectacular.
5864781	5866643	Sí, sería... En concepto, está buenísimo,
5866663	5868144	pero yo a veces, para hacer un video de dos minutos,
5868184	5870886	estoy un mes. Así que, para hacer una película de ochenta,
5870906	5871926	se lo que me va a volver loco.
5872488	5876189	¿Y el concepto es el multivergazo y te tiene a vos adentro?
5876209	5882871	Sí, sí, yo sería actor principal y iríamos a otras partes capaz que...
5882891	5884371	O sea, atravesás el cine.
5884551	5891153	Claro, habría, digo, habría cosas de que yo me pasó a otro multiverso que va al pasado
5891193	5893274	y por ahí agarró este footage mío del 2006.
5894955	5898216	Tendría que revisar todo. Sería un... Ahí creo que tendría que...
5898677	5901878	Que salir de mi zone de confort y tener un equipo de gente.
5901938	5905720	Ahí es equipo o equipo, boludo. Sí, si no, no lo podría ser.
5905760	5909602	Pero creo que estaría buenísimo y creo que a mucha gente le gustaría.
5909622	5910782	Creo que sería algo que...
5912843	5914484	No sé cómo haría para recuperar...
5915084	5917566	Digo, la plata. Sería plata que la de gente donne
5918026	5921447	durante un tramo de un año, un año y medio.
5922209	5924850	y para utilizar a la gente que le pagaría, ¿viste?
5925250	5925770	Sí, tal cual.
5926050	5928711	Y después pasarla,
5929191	5932353	capaz que gratis, o cobrar una entrada de uno o dos dólares,
5933393	5934113	este...
5934874	5937715	Y después ahí, olvídate, la gente la va a piratear
5937755	5939235	y la va a poner donde se cante las bolas.
5939255	5940776	Sí, pero ya nace con ese concepto.
5940796	5942637	Yo lo que quiero hacer es la pieza.
5942717	5944978	La voy a hacer para que la vea todo el mundo
5944998	5947939	y no voy a limitarme por copyright,
5947959	5949099	no me voy a limitarme por...
5949941	5956367	escenas que van a ser prácticamente pornográficas, va a ser todo lo que no pude hacer estos años porque
5957288	5961632	son chistes que me cancelarían, son chistes que
5963274	5965216	me cagarían, en la película va a ser
5966479	5967540	lo bueno, lo malo y lo feo.
5967560	5971763	Todo lo que tengo, hasta cosas por ahí que no sean de lo mejor,
5972083	5973564	meter todo ahí.
5973664	5976266	Me encanta la gran obra del Bananero a 20 años,
5976406	5978248	El Multivorgazo, donde va a estar todo.
5978548	5979689	Todo, todo sería.
5979749	5980790	Me emociona.
5980950	5985013	Sí, creo que conectaría varias cosas.
5985053	5988515	Además, mucha gente habla de un UCB,
5988595	5991738	Universo Cinematográfico Bananero, ¿entendés?
5991858	5993479	Con algunos me cruzo con el peluca,
5994261	6003543	este este me conecto con harry no digo es como que hay con algunos tengo conexión este cable rojo
6003583	6009845	y este con otros no uno se conecta con este todo depende así claro es buenísimo boludo bueno y acá
6009885	6014186	la podés estrenar podés hacer funciones también porque la gente para mí independientemente de que
6014206	6016547	la vea pirateada si vos por eso una función
6016867	6025714	Claro, creo que sí. Esa también sería una idea, ir de gira y mostrarla en HD y hacer como un mini monólogo.
6025734	6030858	Bueno, chupavergas. Esto es más o menos mi carrera.
6032360	6037702	Lo vengo haciendo hace muchos años, yo ya tenía un plan como los de Marvel, yo iba a hacer las cuatro etapas.
6037742	6042643	Tenés que armar easter eggs de tus primeros videos del principio, como viste este detalle que no, inventálo.
6042703	6046465	Ustedes no lo veían porque estaba en 320x240 pero en realidad la fecha de lanzamiento de esta película estaba ahí.
6055468	6060533	Buenísimo, bro. Bueno, maestro, yo creo que estamos por acá, por nosotros.
6060553	6062554	Algo que vos quieras, tengas algún tema más, algo que digas, mira,
6062574	6064957	¿sabes qué es lo que quiero contar acá? Esto quiero contar acá.
6065177	6069661	Bueno, ya a esta altura estoy tocando unos temazos,
6069721	6075486	estoy a punto de ser stage diving y estoy pasando una noche de la gran puta,
6075506	6079550	pero excelente. Todos los temas que tocamos yo sabía que
6080312	6083879	y va a ser una charla interesante que por ahí la podemos seguir dos, tres horas más
6084019	6090211	y me va a encantar porque sé que sos un tipo con muchos temas y muy versátil y con toda la onda, papá, así que...
6090716	6091676	¡Sapen!
6091856	6093378	Muchas gracias, hijo.
