start	end	text
2450503	2452123	No me importa, no me importa.
2452343	2455484	Es buen tomador de happy caliente.
2455604	2458345	Quiero compartir una happy caliente con el bananero.
2458385	2459805	Dale, sí, tiramos esto a la mierda acá.
2459885	2463846	Quiero compartir una happy caliente con el bananero
2464326	2467607	mientras seguimos avanzando en este torbellino de emoción.
2467627	2468567	¿Esto qué son, escones?
2468767	2469607	No, estos son chipá.
2469667	2471888	Ah, porque dije...
2471668	2477091	Tomando un té, comiendo un scone. Digo, esto puede hacer un vuelco tipo...
2477191	2478652	Es para mezclar, boludo, es para mezclar.
2478692	2485015	Digo, volvemos... Vamos a hablar un poco de neuroquímica, neurociencia, del S.A.R.
2485035	2488716	Todo, todo, lo que vos quieras. Me interesa, universo, pegarla.
2489357	2492378	La rompés toda. ¿Vos ya volvés a Estados Unidos? O sea, ¿ya estás ahí?
2492418	2494699	Sí, sí, estoy hace rato. El bananero nace en Estados Unidos.
2495481	2497661	En Miami nace, en el lugar tropical.
2498802	2499802	Tuviste...
2501143	2503284	Acá hablamos mucho con gente que...
2503304	2505725	Lo decía Guillaquero otro día, que él dijo, yo estoy consagrado.
2505745	2507065	A ver, una happy... ¿Hay happy's?
2507226	2508866	Muchas happy's.
2510087	2511287	Happy de todos los colores.
2511888	2513548	Happy's de todos los colores, ahí, trajo.
2513568	2514329	Happy Ipa...
2515370	2521373	Y esta, muchos tienen miedo de chuparse una Happy Negra, pero esta dicen que es la más rica de todas.
2521974	2525436	Y mira, tiene las venas y todo de la Happy Negra. Yo hago todos los diseños.
2525756	2526596	¿Vos haces los diseños?
2526617	2529158	Todo el diseño. No dejo a nadie que se meta en mi arte.
2529178	2534781	Y vos agarraste y dijiste, voy a ponerle a una birra Happy y abajo de ponerle la que chupa el bananero.
2534801	2538403	Esto me vuelve loco. Para que cada persona que haga esto se esté chupando una Happy.
2538543	2541605	Sí, también puede ser Happy por felicidad en inglés.
2543228	2543588	Ok.
2544109	2548333	Vamos a ver una happy junto a lo ananero en el metro.
2548354	2549455	Yo te brindo con landes.
2549675	2551237	Brindemos con lo que hay ahora.
2551277	2552938	Salute, papá. Muchas gracias por la invitación.
2552958	2554000	Salute y gracias por venir.
2554040	2554921	¡Salute!
2554941	2558925	Estoy increíblemente feliz en este momento.
2558945	2562008	Quiero que lo sepa mi público y todos mis amigos de toda mi vida.
2563011	2563692	¿Está rica la happy?
2563892	2565253	Está riquísima la happy.
2565333	2566053	Gracias, Bananero.
2566293	2566734	Gracias a vos.
2566974	2567214	Escúchame.
2567234	2569155	Escúchame.
2570396	2571677	Dijiste algo increíble que es
2572017	2573458	llegué a donde quería llegar
2573478	2574179	toda mi vida.
2575099	2577081	Ese momento fue...
2577101	2577561	Me deprimí.
2578682	2579342	Eso quería hablar.
2579382	2580363	Claro, lo dije.
2580483	2581324	Ya cumplí mi sueño.
2581344	2581884	¿Ahora qué hago?
2582504	2583745	Porque además no podía
2583765	2585967	cuantificar todo lo que tenía.
2585987	2586847	Traté de hacer plata.
2586867	2587328	No podía.
2587828	2590870	Me trataron de meter en un show
2590890	2592131	de televisión en Miami.
2593593	2598154	pero querían cambiar el contenido, que no sea puteadas, tampoco me iba.
2598194	2602116	Me dijeron para venir a Argentina a hacer algo, pero tenía que mudarme a Argentina.
2602716	2608558	Entonces tenía todo, pero no tenía nada, porque no podía sacar de provecho
2609399	2614140	de lo que había hecho. Inclusive vine para acá en el 2009
2616302	2621226	y intenté venderle un concepto de hacer doblajes a MTV.
2621826	2623888	Los MTV me mandaron a la mierda,
2623968	2625469	me fui a un par de agencias de publicidad
2626610	2629131	y le mostré los trailerazos, no les gustó,
2629191	2631833	y fue como que volví súper derrotado
2632273	2633694	porque no podía hacer plata
2633794	2638097	por ninguno de los sistemas de ads de Google ni nada.
2639418	2642720	Y estaba como que dije, pa, ya está, se terminó el hobby,
2642740	2643081	¿qué más hago?
2646684	2649666	Y bueno, ahí se empezaron a dar ciertas situaciones en mi vida.
2650247	2652728	Estuvo un momento un poco triste, oscuro.
2653068	2655090	¿Qué edad tenías, por ejemplo, en esta etapa?
2655130	2655930	Eso te estoy hablando, 2009.
2655970	2656270	Y bueno.
2661195	2664716	Permiso, amor. Estaba en una relación, me empecé a divorciar.
2664736	2666436	Mi padre se agarró… ¿Estabas casado?
2666676	2668797	Sí, sí. Pero es innombrable, así que no…
2668817	2671498	No se puede hablar del tema. ¿Es innombrable?
2671518	2673958	Hay autorización acá detrás de cámara.
2674418	2678179	Sí, sí. El bananero fue uno de los motivos a la separación.
2678440	2680020	¿El bananero es motivo de separación? Sí, sí.
2680040	2682581	Así que, por suerte, la verdad que…
2682781	2684641	Pero vendá colchudo.
2684701	2686262	Ok, no salió bien, pero… Sí, sí.
2686422	2687682	¿Por qué el bananero rompe…
2689283	2692344	¿Por qué el bananero rompe la relación o es un motivo de que...
2692364	2694545	No, porque dedicaba muchísimo tiempo al bananero
2695946	2698947	y se sentían, no sé, como que...
2699887	2704729	Dedicaban más tiempo al bananeo que a la pareja y era verdad, totalmente verdad.
2704749	2708250	No tenían ningún interés en la pareja y el bananero le destinaba muchísimo tiempo.
2708511	2713052	como que jamás se habría imaginado que estabas casado.
2713232	2716232	Que eras un tipo casado haciendo una manera, no sé por qué.
2716272	2719713	Por verlo de chico, de pibe, es como este, es como yo.
2719733	2720793	Yo lo que sentí era...
2720813	2723353	Sí, eso en realidad es como yo me sentía.
2723373	2724313	Digo, este...
2725674	2729834	Y todo el contenido era como una reacción a estar casado
2729854	2731395	sin querer estar casado, ¿viste?
2731635	2736035	Todo ese humor era como eso, el material que alimentaba eso,
2736055	2738136	porque no estaba feliz. No estaba feliz, claro.
2739116	2746940	Y eso me llevó a eso, me compré una casa que no podía bancar solo,
2747280	2750321	entré en ciertos vicios, a automedicarme y todo.
2750881	2754763	Y ahí creo que fue medio la peor época, donde casi el bananero termina,
2755303	2758445	que también tiene que ver que es como una bola de nieve por todo esto,
2758485	2761066	que no podía cuantificar, no podía vender, no podía hacer nada.
2761086	2766228	Es como que tenía todo este personaje y todo, y todo barbo, soy el bananero,
2766268	2767189	pero no puedo...
2767970	2772854	hacer plata no puedo entender no puedo explotarlo ni nada y fueron dos o tres años complicados hasta
2772874	2780119	que empezó empecé a monetizar en algunos lados y empecé a hacer las giras bananeras que eso fue
2780139	2786844	lo que me salió me sacó un poco del pozo de mirá y eso fue increíble digo conocí toda latinoamérica
2787765	2794510	este del 2004 2000 fines del 2013 hasta el 2019 recorrido a latinoamérica probé la cocaína de
2794530	2797232	todos los países gozo este
2799454	2801855	Y tal, no me acuerdo de nada.
2802195	2805616	O sea que de la depresión te sacó la cocaína.
2805636	2810478	Sí, exacto. Es un buen colchón para caer.
2810518	2812778	No, digo, fue bueno para...
2813498	2814939	Yo, como te digo, tengo pánico escénico.
2815539	2819140	Me da mucha vergüenza salir y...
2819760	2822301	Porque me considero que estoy haciendo algo...
2823723	2828768	vendiendo algo que no tengo para vender, entiendo, estoy vendiendo humo, yo soy bueno editando vídeos, haciendo voces
2829469	2835676	yo no soy un entretener que soy bueno con micrófono y diciendo ah hola cómo están, lo puedo hacer si estoy mamado
2837159	2838821	Pero no te sentís ahí, es que no es que vos decís esto.
2838841	2843045	En realidad me siento y lo disfruto muchísimo, pero es como que siento que los estoy robando.
2843666	2845748	Es un tema de ego y de inseguridad, ¿no?
2845988	2851034	Eso, pero es re loco, lo hablamos mucho acá, bol, o sea, te pasa, me imagino, ¿no?, con
2851054	2854197	lo que haces y la curaduría de lo que haces y lo que te importa, porque me doy cuenta
2854217	2854817	de que te importa.
2856962	2860104	Vos haces arte, boludo, y hay una dimensión que siempre tiene el arte
2860124	2861404	que te lo podés tomar de dos maneras.
2861464	2865547	O vos sabés que es una joda y vivís con eso, o vos vivís un poco conflictuado
2865567	2867908	con la idea de che qué estoy haciendo, de verdad estoy vendiendo video
2867928	2872271	con gente que dice sape. Sí, sí, sí, me consulto eso
2872291	2875653	muchas veces, digo, este, voy de pensar.
2875893	2881357	Soy el uno, sape, mirándome el espejo y digo, soy un ladrón garca, viste?
2882057	2884039	Creo que eso va también mucho en
2885061	2893389	En eso de ser artista, si consideras que realmente lo que vos estás haciendo es honesto y es genuino
2893409	2897994	y estás dando algo, o solo estás haciendo cosas para vos y para alimentar tu ego, ¿viste?
2899497	2903840	Pero va y viene, es como todo, ¿viste? Todos tenemos momentos buenos y malos, y creo que...
2903860	2909903	a veces, digo, te tenés que quedar con el equilibrio. Yo creo que, entre todo, digo...
2910444	2915327	le doy algo a la gente, porque la gente me dice, vos, flaco, a mí me sacaste de la depresión
2915847	2920710	tus vídeos cuando estaba mal con mi novia, lo único que pensaba, y esto me...
2920831	2926154	¿Entendés? Y si pudieras hacer eso con cien, con mil personas, ¿viste? Ya...
2926174	2927075	vale la pena, ¿viste?
2927315	2928836	Es un montón, boludo, es un montón.
2929377	2933559	Creo que está bien, así que eso ahora me siento bien, de vuelta.
2933679	2937980	Y ahí de la mala vos la giras, ¿es una idea tuya como que agarras el cis?
2938040	2939341	¿Por qué no le doy una dimensión?
2939361	2943082	No, no, fue un error total, me invitaron, yo estaba repuesto, remamado.
2944142	2947783	Nico Bianchi, no sé si lo conocés, un chico que de los tres caveados,
2948464	2951285	unos que hacían jodas telefónicas, que es amigo mío, es el que me presentó a ella.
2952526	2955927	Este, por suerte, ella me cambió la vida también.
2956407	2956788	¿El amor?
2957128	2959028	Sí, me sacó de las malas juntas, me dijo,
2959048	2962130	dejá de juntarte con ese muy lento, con ese falopero,
2962150	2963250	con este otro...
2963270	2966692	Digo, no así, pero me dijo, tipo, ese no me cae bien.
2967432	2968413	Es un sucio.
2968513	2971494	Una sugerencia de vinculación.
2971534	2973335	No me lo decía así, pero cada vez que yo me juntaba,
2973355	2975175	decía, ah, sí, estuviste con...
2976437	2978721	Y entonces dije, OK, si la quiero contesta...
2979121	2979341	Sí.
2980002	2984569	Y bueno, me quedé con todo lo que ella representó
2984629	2985851	y la verdad, me cambió la vida.
2986714	2987414	Te amo, mi vida.
2988094	2989175	Soy un romántico, a veces.
2990115	2992475	Me pueden decir, gordo de cabuete.
2993395	2994776	¿Verdad? Y te invitan.
2994816	2997796	Vos decís que estás repuesto. Sí, dale, dale, gás.
2997816	2999697	Te sirve, mira, te pagamos pasaje.
2999957	3001677	¿Te invitan? ¿Te llega la invitación?
3001717	3005518	Sí, me dicen, vamos a ser youtubers live a fin del 2013 en el grupo.
3005538	3008559	Permitidme acá. Vos seguís, pero creo que, si hago eso, estamos perfectos.
3009059	3015601	vamos a hacer este youtubers live que va a estar marito vedito va a estar todos estos este te pagamos
3015641	3021404	pasaje mil dólares te sirve si mas bien yo estaba re duro y mamado serían las 11 de la noche dije
3022244	3029907	sabes lo que este estoy le respondí el mail al otro día con cole paja te desperté no le
3029927	3034188	tengo que decir que no que estaba mamado y le respondí cuando voy a chequear el mail me mandan el
3035430	3038351	el afiche que habían hecho que ya estaba pegado en todos lados.
3038391	3040872	Ya al otro día, porque me desperté a las 3 de la tarde, ¿viste?
3040972	3045035	Al otro día ya estaban los afiches pegados, el bananero así.
3045055	3045915	Fueron rápidos, ¿sabes?
3045975	3046655	Sí, fueron rápidos.
3046675	3048476	Bananero dentro ya estaba confirmado.
3048516	3050998	Y tal, quería decir que ya está, se te cargo, papá.
3051078	3055780	Si te gusta el durazno, bancate la peluza y está.
3056921	3059622	Y ahora qué hago? Bueno, y ese fue el primer show y fue...
3059682	3060803	¿Por dónde arrancó? ¿Dónde irá?
3061443	3062083	Ester en Groove.
3062765	3065906	en el grupo de Buenos Aires, sí, acá fue el primer show.
3066687	3069428	No tenía la más puta idea que hacer y no me acuerdo de nada,
3069448	3073009	porque pedí sustancia, pedí una botella de Jagger
3074330	3076931	y tenía mi propio camerín, yo estaba solo y todos los demás
3076951	3080253	youtubers tenían su camerín K2 de calcio y me fui al camerín de ellos,
3080273	3084354	porque yo estaba re aburrido solo y me fui y hacíamos pogo
3084434	3087856	y chupábamos un shot de Jaggermeister y cuando vamos a hacer el show
3088477	3090359	¿Qué tuviste que hacer? ¿Qué era?
3090379	3093061	Nada, era tipo, armé como una presentación,
3093081	3094422	viste, soy el bananero, blablabla,
3094442	3095783	unos me conocen como esto o lo otro,
3095803	3097384	tiro unos videos y esto o lo otro.
3098345	3099345	Este, no me acuerdo nada.
3099706	3102067	Cada medio metro del piso, este, es más, en una...
3102648	3104149	¿Pero podés funcionar así, boludo?
3104229	3106411	Y yo creo que sí, digo, estoy, digo, no paro de hablar,
3106471	3107892	en un flaco me tiro una botella.
3109454	3118080	Y digo, si le embocás en la cabeza, te regalo una muñeca así, te empiezan a llover y empiezo a esquivar las cabeceadas, las paradas de pecho.
3118160	3121162	¡Es una locura! ¡Más, más, más!
3121242	3128746	Y yo agarraba y se las tiraba a ellos. Era todo en buena onda, ¿viste? Y el flaco decía, ¡paren de regolear, paren de regolear! Y se las tiraban a él, ¿viste?
3130709	3136671	No, fue un caos, lo tengo todo filmado pero no me da pasar como 11 o 8 años ya y no me
3136691	3143654	da vergüenza o algo por verme la cara que estoy re... Estaba en otro lado. Sí, sí, sí, la mandíbula mandibuleando mal.
3146357	3155206	La primera vez rompí el hielo con un hacha, con público, como puedo hacer esto, lo puedo
3155246	3160792	hacer, pero ya sé que necesito esto antes, entonces todas las giras, en todos los lugares,
3160852	3165817	ok, mi contrato es esto y necesito esto y esto esperándome en el hotel.
3166439	3168481	¿Por contrato? O sea, si has querido estar repuesto.
3168901	3173524	Sí, si quiero cocaína y whisky o ron o esto o lo otro, en todos lados.
3173664	3175105	Eso parece un contrato de Mick Jagger.
3175125	3179348	Claro. Una vez iba a pedir los M&M, pero sin los M&M negros,
3179368	3180529	pero me pareció muy racista.
3180949	3185812	Eso lo hacía Van Halen, eso es de parte de la elección urbana.
3185952	3189915	Bueno, a tu manera, recontra, lograste el Slash.
3190657	3191457	Sí, sí, creo que sí.
3192217	3196319	Es más, digo, yo sigo fumando y él dejó el cagón.
3196339	3197179	Chupá a la Slash.
3198700	3201741	Le podés decir en tu cara, Slash, ahora vos tenés mi póster en tu pared.
3202462	3207946	Y ahí hiciste gira a Latinoamérica y le encontraste por lo menos una, no sé, monetización.
3208026	3215812	Sí, sí, sí. Los lugares que estuve, muchas veces me llamaban porque la gente que me seguía
3215852	3220656	a mí también era seguidora de anime. Entonces, en un show estaba el que hacía la voz de Goku.
3220976	3224399	¿Qué pasó? ¿Qué hacen las voces?
3224419	3225119	Sí, sí, los doblajes.
3227202	3229084	Y eso es uno viejo, todo hecho mierda, ¿viste?
3229104	3232747	Yo estaba a las 10 de la mañana en el meet and greet con una petaca así, ¿entendés?
3232767	3238433	Chupando y dice, no mames, tú estás bebiendo, papá soy el bananero, ¡sapi!
3240114	3246460	Y los pendejitos venían a foto y alguno me dijo, bananero hueles al sol, claro, pendejo,
3246480	3247961	soy el bananero, salí, ¿querés foto?
3249544	3253304	Qué buenas tetas tiene tu madre. Era una cagada, era un desastre.
3253745	3256465	Es conocer a Krusty, es increíble conocer a Valeriano.
3256485	3259826	Todos los peores personajes eran Van Santa, ¿viste?
3260246	3262806	Era eso también, me metí encima, un desastre.
3262826	3264787	Te metiste encima en el medio de gira también?
3264827	3267887	Sí, una vez no podía salir, digo, me metí un poco para el costado
3267947	3270708	y me quedé un poco ahí y me presenté de pijama, cualquier cosa.
3270828	3273389	Es bastante rockera la gira, la gira.
3273949	3279576	Al mismo tiempo, mira, te tengo que decir algo, para mí eso, si bien puede ser hostil
3279596	3284341	para el niño de ocho años que dijo, no eres mío, lo empecás a escabiar, si bien hay
3284381	3288346	una porción de hostilidad, hay algo de mitología también, boludo, porque, por ejemplo, una
3288366	3291509	anécdota que recuerdo un amigo mío es que una vez te cruzó en un aeropuerto...
3292552	3299458	que te dijo eh bananero y creo que él relata con fascinación como vos en un instante le
3299478	3305763	contestas que pasa chupapig así y él dice yo no puedo creer era el bananero es el bananero
3305783	3309986	todo el tiempo dice si si es verdad trato de serlo como eso también es como el gran
3310006	3313789	truco de nolan viste el chabón que está comprometido hace el bananero yo no sé algo
3313809	3316251	en algún momento no o sea vos llegas a tu casa y respires es
3318033	3320054	Sí, cuando termino las giras odio al bananero.
3320194	3322455	Decir tanto sape, creo que es como decís...
3322535	3325476	Pasar los 600 sape por día y es como que...
3326036	3327456	Es como que ya te empieza...
3327757	3330538	Viste, por dentro, te empieza a venir como una acidez de sape.
3330598	3331098	Así es de sape.
3331118	3334839	Creo que hay un máximo de sape por día que podés decir.
3334879	3338520	Y te odias, vos mismo, fotos, con todo, viste, es demasiado.
3338620	3339401	Te vuelve loco.
3339421	3341041	Claro, sí, no quiero decir sape por dos, tres días.
3341061	3342162	Ahora me gano la vida con eso.
3342882	3346863	Grabo saludos y los puteo a la gente, le digo...
3348045	3353191	Bueno, muchos saludos, cumpleaños y todo y estoy viviendo gracias al ZAPE.
3353211	3355053	Es una locura.
3355073	3357616	Sí, no es increíble. El poder del ZAPE...
3358097	3362101	Eso es algo relativamente reciente que ahora vos vivís.
3362121	3363503	Sí, sí, un poquito antes de la pandemia.
3364226	3370589	Yo empecé a hacer una app, una se llamaba Rompemuñeca, que era una app que cuanto más rápido hacías, hacías más puntos.
3370609	3372190	Increíble, increíble.
3372210	3374391	Pensé que iba a ser un éxito, no lo fue.
3374431	3376792	¿No lo fue? Suena un éxito.
3377352	3378233	Suena un éxito.
3378253	3379173	La gente no está lista.
3379193	3382895	La gente es muy vaga, muy algo holgazana, no quiere mover, quiere vistas.
3383877	3390399	La trucaban, ¿viste? Le ponían un agitador y rompían récord y se ganaban camisetas y todo.
3390459	3392159	No sé qué más de estos pendejos están de vivo.
3392299	3393560	Poco fair play de paja, boludo.
3393580	3394540	Sí, no, no, eso...
3395360	3396041	Sin códigos.
3396061	3397301	Sin códigos de paja, mal.
3397321	3398041	No hay códigos, boludo.
3398061	3398982	Como yo con mi padre.
3399002	3399702	Se perdió el honor.
3399842	3400122	Ahí, ahí, ahí.
3400142	3401703	Yo les digo, yo sabía de eso.
3401783	3402183	Claro.
3402223	3403383	No pocos códigos de paja.
3403443	3404003	Salute, bacho.
3404363	3404584	Este...
3412927	3414509	Pero está, como te digo, en las giras.
3414809	3419373	Igual ahora creo que estoy un poco más preparado para eso,
3419393	3421615	porque lo tomé como un trabajo, porque yo siempre tuve un trabajo
3421815	3425177	siendo alguien que trabajaba en televisión.
3425358	3429981	Y es como lo del bananero, era algo que hacía porque me gustaba como hobby,
3430001	3432944	porque era mi orgullo, era algo que yo había creado,
3432984	3437327	era una arte que yo hacía. ¿Cómo se llama cuando haces...
3440674	3444398	vas en la calle y haces algo de arte por encima de la calle.
3444658	3445679	Como un graffiti, no, no sé.
3445699	3445899	¿Para qué?
3447261	3447501	¿Cómo?
3448744	3448944	No.
3449964	3450645	Cuando intervenís.
3451085	3453546	Cuando intervenís, está bien aplicado.
3453566	3453846	Sí, sí.
3453886	3457188	Era una forma de intervenir en vida misma el personaje
3457208	3459769	haciendo las giras. Pero en algún momento, o sea, convivió
3460449	3463070	la mayor popularidad con no poder vivir de eso.
3463511	3465231	Y ahí tenías... Sí, sí, al pedo, claro.
3465251	3467833	Como en otras, mi popularidad en los vídeos era rebaja,
3467853	3469774	pero estaba haciendo más plata en las giras.
3469894	3473315	Y en tu laburo formal, ponéle, ¿sabían que eras el bananero
3473355	3474356	o eras Clark Kent?
3474716	3477957	No, no, siempre fui el bananero. Es más, fui, filmé...
3479799	3485780	videos en el canal y tuve problemas por eso, sí, sí, sí, porque salieron y dijeron no,
3485800	3491762	porque justo estaban pelotas también el video ese que filmaba en el baño, está cagando
3491782	3496863	y viste, estaba puteando talía, viste, entonces, pero no, no puedes hacer eso, se nota el logo,
3496903	3501264	trapar el logo, hijo de puta, se veía el logo, viste, no sabía tapar el logo en ese
3501284	3504445	entonces, y dijeron no, no hagas más videos.
3504185	3506546	Pero mucha gente se supone.
3506626	3508326	Finalmente, ahora es como que...
3508366	3511167	Siento que es el sueño del pibe, boludo.
3511187	3514448	O sea, es como si hubieras logrado hacer una carrera
3515048	3516649	de cagarte de risa, boludo.
3516689	3520470	Sí, ahora, hace un tiempo, puedo decir que estoy...
3521291	3523353	viviendo, haciendo lo que se me canta, los huevos.
3523373	3526215	Tengo mi novia, que es la mujer de mis sueños,
3526315	3528417	rubia, pechugona, que no me rompe los huevos,
3528437	3529798	¿qué más puedo pedir? Es divina.
3530538	3533701	Trabajo en calzoncillos, vivo en Miami, a diez cuadras en la playa.
3534582	3536944	Pero a veces tampoco soy feliz y digo, puta madre,
3537044	3540126	¿por qué uno es tan exigente y por qué uno siempre...?
3540227	3543950	Y uno tiene que aprender a decir, OK, vos no seas tan rompehuevo,
3543970	3544650	¿viste? Tratá de...
3546814	3551497	de conformarte, pero conformarte no es la palabra, es tratar de ver las cosas lindas y...
3551658	3555000	En esos momentos creo que puede venir bien tener esta realización de que,
3555020	3558503	yo siento que es como si tuvieras el cheat code de la realidad.
3558683	3560445	O sea, la craqueaste, es como ver la Matrix.
3560525	3564708	Sí, no, eso me di cuenta porque el que me trajo en Uber era un colombiano
3565229	3567050	y si usted a que se dedica, me dice...
3568093	3570875	Te digo, la verdad, puteo gente en calzoncillo.
3571595	3574037	Ese trabajo es una chimba, parce, me dice.
3574117	3575879	Claro. Sí, me está jodiendo.
3575939	3578221	No, no, de verdad, trabajo en eso.
3579702	3582024	Y soy comediante y ahora voy a presentarme en un teatro.
3582104	3584686	Usted tiene el trabajo soñado, y si no te lo dice alguien.
3584786	3587548	Yo vivo lo que pasa muy contenido, muy solo.
3588249	3592272	Veo a mi gata, a la que me limpia la casa del supermercado
3592312	3593473	y a mi novia todos los días por...
3594295	3597097	por cámara, entonces capaz que al no tener tanto intercambio,
3597117	3600379	bueno, cuando hago Radio Barca, al no tener tanto intercambio con gente
3600399	3602761	por ahí, viste, yo jugando al ping pong conmigo mismo,
3602861	3605863	este es como que hay algo en ese aislamiento también que de repente
3605883	3608465	empezás así, sabes que estoy hinchado los huevos y no tengo esa,
3608585	3611307	no me refrendan que la estoy rompiendo ni una mierda.
3611347	3614789	Sí, a veces te sirve, viste, porque no hay nadie jodiendo tenis
3614849	3619032	y metiéndose en tu vida, pero este sí, este por ahí tenés.
3620796	3625703	necesidad de tener un intercambio social, viste, es necesario, sin duda es necesario.
3625723	3627746	Yo digo, la rimo bastante bien igual, pero...
3628490	3631793	Bueno, hablaste... Lo quería mencionar también, pero hablaste de Radio Garca,
3632014	3634516	yo veo Radio Garca, me parece excepcional.
3634536	3635437	Muchas gracias.
3635457	3638039	Son los viernes a la noche. Sí.
3638239	3642223	Hay trece, quince Lucas gente mirándote escabiar en YouTube.
3642363	3645866	Sí, sí, es una locura, la verdad, es un lindo formato
3645926	3649169	y creo que nadie lo hace, así que se vaya tanto al...
3649189	3650771	Digo, bueno, no se habló del canal hace poco.
3651413	3652374	Ah, mirá, bro.
3652414	3656256	No sé si vos viste que tenemos una sección que nos metemos en Omegle.
3656537	3656717	Sí.
3656737	3659999	Y sabés cómo terminamos.
3660099	3661000	Obviamente.
3661020	3663541	Hace un par de... Creo que el 30 de septiembre
3663802	3667664	estábamos tomando shots de Jack Daniels, lo que tomaba Slash,
3667744	3669426	y nos estaba muy suelto.
3670769	3676196	Nos metemos en omegle para interactuar con gente, nos metemos y charlamos con gente
3676216	3681083	y después lo ponemos en la parte no moderada y aparece gente manoteándose el ganso.
3682566	3684707	Hay una búsqueda de ser baneado.
3684747	3691830	Sí, es como jugar a ver hasta dónde es la línea
3691850	3692590	que se pueda pasar.
3693390	3695411	Pero no pasaba nada, nos dejaron, nos dejaron.
3696291	3700853	Pero esta vez apareció un gordo acostado en un sofá
